{
 "$id": "RULECARD_SCHEMA.json",
 "$schema": "http://json-schema.org/draft-07/schema#",
 "additionalProperties": false,
 "definitions": {
  "evidenceSurface": {
   "description": "Same value set as FACT_RECORD_SCHEMA.json evidence_surface.",
   "enum": [
    "fw_context_read_file",
    "fw_context_list_conditional_regions",
    "fw_context_explain_condition",
    "fw_context_find_callers",
    "fw_context_lookup_symbol",
    "fw_context_search",
    "independent_grep",
    "independent_clang_e",
    "build_manifest_diff",
    "other_independent"
   ],
   "type": "string"
  },
  "factRef": {
   "additionalProperties": false,
   "description": "Canonical reference to a FactRecord. This shape is IDENTICAL in FACT_RECORD_SCHEMA.json, MECHANISM_HYPOTHESIS_SCHEMA.json and RULECARD_SCHEMA.json; source of truth is FACT_RECORD_SCHEMA.json#/definitions/factRef.",
   "properties": {
    "fact_id": {
     "description": "fact_id of the referenced FactRecord row in the immutable K1 fact log.",
     "pattern": "^F-[A-Z0-9-]+$",
     "type": "string"
    },
    "trust_class": {
     "description": "Inherited-trust check: must equal the trust_class recorded in the fact log for fact_id. T1 refs are valid only as K1-mediated claims; T2 refs are never load-bearing (E2).",
     "enum": [
      "T0",
      "T1",
      "T2"
     ],
     "type": "string"
    }
   },
   "required": [
    "fact_id",
    "trust_class"
   ],
   "type": "object"
  }
 },
 "description": "Deterministic, refutable fault-detection/diagnosis rule card. Satisfies S0_GOAL_ADR.md section 2 rubric items 8 and 10 and FAULT_DISCOVERY_REQUIREMENTS.md FR-1 (schema freeze per FR-9). Free text is permitted ONLY in rationale fields; refutation results are adjudicated per REFUTATION_STATE_MODEL.md. Authoritative goal (verbatim): \u6784\u5efa\u4e00\u4e2a Agent\uff0c\u80fd\u591f\u4ece\u6e90\u4ee3\u7801\u4e2d\u53d1\u73b0\u56fa\u4ef6/\u8f6f\u4ef6\u6545\u969c\u673a\u5236\uff0c\u5e76\u63a8\u5bfc\u51fa\u76f8\u5e94\u7684\u6545\u969c\u68c0\u6d4b/\u8bca\u65ad\u89c4\u5219\u3002",
 "properties": {
  "evidence": {
   "description": "Load-bearing evidence chain as canonical FactRecord refs. Each ref's trust_class MUST be inherited unchanged from the fact log for its fact_id (a mismatch is an E1 violation and invalidates the RuleCard). T2 refs are never load-bearing (E2); single-line/fragment claims require at least 2-surface cross-check before load-bearing use (E3).",
   "items": {
    "$ref": "#/definitions/factRef"
   },
   "minItems": 1,
   "type": "array"
  },
  "fault_class": {
   "description": "Fault family. Wave-1 families: condition_config_gated | init_submit_pairing | existence_absence | direct_flow_presence (S0_GOAL_ADR.md section 8).",
   "minLength": 1,
   "type": "string"
  },
  "forbidden_overclaims": {
   "description": "MUST be non-empty (FR-7 and the two-part C1 separation, WAVE1_CORPUS_MATRIX.md section 2): wherever runtime occurrence is not source-provable, the RuleCard explicitly lists the claims it does NOT make (e.g. queue full occurred; submission was lost at runtime; any resource-exhaustion claim).",
   "items": {
    "minLength": 1,
    "type": "string"
   },
   "minItems": 1,
   "type": "array"
  },
  "hypothesis_ref": {
   "description": "MECHANISM_HYPOTHESIS_SCHEMA.json hypothesis_id this RuleCard was derived from; that hypothesis MUST have status promoted_to_rule.",
   "pattern": "^H-[A-Z0-9-]+$",
   "type": "string"
  },
  "mechanism_id": {
   "description": "Mechanism identifier minted at promotion time from the source hypothesis (FR-1 field).",
   "pattern": "^M-[A-Z0-9-]+$",
   "type": "string"
  },
  "oracle_provenance": {
   "description": "Origin of the adjudicating oracle: blind (custodian-held, not visible to the solving agent), commit_derived (upstream fix commit), field_log (field incident record), none (no oracle used).",
   "enum": [
    "blind",
    "commit_derived",
    "field_log",
    "none"
   ],
   "type": "string"
  },
  "polarity": {
   "description": "positive = asserts the mechanism/trigger holds; negative = asserts absence/detection-by-absence; lower_bound = partial detection admissible only as a lower bound (G7).",
   "enum": [
    "positive",
    "negative",
    "lower_bound"
   ],
   "type": "string"
  },
  "provenance": {
   "additionalProperties": false,
   "properties": {
    "certainty": {
     "description": "Overall derivation certainty; degraded is admitted only for non-load-bearing labeling (E2/E6).",
     "enum": [
      "measured",
      "attested",
      "inferred",
      "degraded"
     ],
     "type": "string"
    },
    "derived_from": {
     "description": "Evidence surfaces the RuleCard derivation actually used (values as in FACT_RECORD_SCHEMA.json evidence_surface).",
     "items": {
      "$ref": "#/definitions/evidenceSurface"
     },
     "minItems": 1,
     "type": "array"
    },
    "k1_mediated": {
     "const": true,
     "description": "Wave-1 RuleCards are issued only through the K1 evidence gateway; always true.",
     "type": "boolean"
    }
   },
   "required": [
    "derived_from",
    "certainty",
    "k1_mediated"
   ],
   "type": "object"
  },
  "refutation_protocol": {
   "additionalProperties": false,
   "properties": {
    "oracle_requirement": {
     "description": "Oracle needed to adjudicate the protocol (e.g. blind planted oracle held by the custodian; commit-derived ground truth; field log; none). Must be consistent with oracle_provenance.",
     "minLength": 1,
     "type": "string"
    },
    "steps": {
     "description": "Executable refutation steps, each replayable under the recorded freeze_id.",
     "items": {
      "additionalProperties": false,
      "properties": {
       "action": {
        "description": "query_substrate_via_k1 = replay a K1-gated substrate query; independent_crosscheck = run an independent channel (grep/rg, clang -E, manifest diff); inspect_condition = re-inspect the conditional chain (condition text, run-pinned); construct_counterexample_search = deterministic search for an input/location that violates the rule.",
        "enum": [
         "query_substrate_via_k1",
         "independent_crosscheck",
         "inspect_condition",
         "construct_counterexample_search"
        ],
        "type": "string"
       },
       "expected_two_outcomes": {
        "additionalProperties": false,
        "description": "A-priori observation semantics of THIS STEP. This is NOT the superseded two-outcome refutation RESULT wording (rule_falsified | oracle_falsified) from FR-1; results are adjudicated per REFUTATION_STATE_MODEL.md.",
        "properties": {
         "rule_falsified_when": {
          "description": "Observation that falsifies the rule.",
          "minLength": 1,
          "type": "string"
         },
         "rule_holds_when": {
          "description": "Observation that supports the rule.",
          "minLength": 1,
          "type": "string"
         }
        },
        "required": [
         "rule_holds_when",
         "rule_falsified_when"
        ],
        "type": "object"
       },
       "inputs": {
        "additionalProperties": true,
        "description": "Executable inputs for the action (surface, exact query/command, target file and lines, freeze_id, oracle handle).",
        "type": "object"
       },
       "step_id": {
        "description": "Step identifier (e.g. R1, R2).",
        "pattern": "^[A-Z0-9-]+$",
        "type": "string"
       }
      },
      "required": [
       "step_id",
       "action",
       "inputs",
       "expected_two_outcomes"
      ],
      "type": "object"
     },
     "minItems": 1,
     "type": "array"
    }
   },
   "required": [
    "steps",
    "oracle_requirement"
   ],
   "type": "object"
  },
  "refutation_result": {
   "additionalProperties": false,
   "allOf": [
    {
     "if": {
      "properties": {
       "state": {
        "const": "REFUTED"
       }
      },
      "required": [
       "state"
      ]
     },
     "then": {
      "properties": {
       "counterexample_ref": {
        "minLength": 1,
        "type": "string"
       },
       "protocol_completed": {
        "const": true
       }
      }
     }
    },
    {
     "if": {
      "properties": {
       "state": {
        "const": "NOT_REFUTED_WITHIN_SCOPE"
       }
      },
      "required": [
       "state"
      ]
     },
     "then": {
      "properties": {
       "counterexample_ref": {
        "type": "null"
       },
       "missing_evidence_refs": {
        "maxItems": 0
       },
       "protocol_completed": {
        "const": true
       }
      }
     }
    },
    {
     "if": {
      "properties": {
       "state": {
        "const": "INCONCLUSIVE"
       }
      },
      "required": [
       "state"
      ]
     },
     "then": {
      "properties": {
       "counterexample_ref": {
        "type": "null"
       },
       "missing_evidence_refs": {
        "minItems": 1
       },
       "protocol_completed": {
        "const": false
       }
      }
     }
    },
    {
     "if": {
      "properties": {
       "state": {
        "const": "UNEXECUTED"
       }
      },
      "required": [
       "state"
      ]
     },
     "then": {
      "properties": {
       "adjudicated_at": {
        "type": "null"
       },
       "counterexample_ref": {
        "type": "null"
       },
       "missing_evidence_refs": {
        "maxItems": 0
       },
       "protocol_completed": {
        "const": false
       }
      }
     }
    }
   ],
   "description": "Adjudicated refutation outcome. Conforms to the machine-readable contract (state transition table plus acceptance matrix) at the end of REFUTATION_STATE_MODEL.md. SUPERSEDES the historical FR-1 two-outcome result wording rule_falsified | oracle_falsified (see REFUTATION_STATE_MODEL.md section 0).",
   "properties": {
    "adjudicated_at": {
     "description": "ISO-8601 UTC adjudication timestamp; null while UNEXECUTED.",
     "format": "date-time",
     "type": [
      "string",
      "null"
     ]
    },
    "counterexample_ref": {
     "description": "Reference to the verified counterexample artifact when state is REFUTED; otherwise null.",
     "type": [
      "string",
      "null"
     ]
    },
    "missing_evidence_refs": {
     "description": "When state is INCONCLUSIVE: identifiers of the unobtainable required facts (MECHANISM_HYPOTHESIS missing_evidence entries or K1 fact-log refusal rows); otherwise empty.",
     "items": {
      "minLength": 1,
      "type": "string"
     },
     "type": "array"
    },
    "protocol_completed": {
     "description": "True only when every protocol step executed to completion within the declared scope.",
     "type": "boolean"
    },
    "state": {
     "description": "Adjudication state per REFUTATION_STATE_MODEL.md sections 1-2. UNEXECUTED is the initial state, not a scored outcome.",
     "enum": [
      "UNEXECUTED",
      "REFUTED",
      "NOT_REFUTED_WITHIN_SCOPE",
      "INCONCLUSIVE",
      "ORACLE_CONFLICT"
     ],
     "type": "string"
    }
   },
   "required": [
    "state",
    "protocol_completed",
    "counterexample_ref",
    "missing_evidence_refs",
    "adjudicated_at"
   ],
   "type": "object"
  },
  "rulecard_id": {
   "description": "Unique RuleCard identifier (e.g. RC-C1-001).",
   "pattern": "^RC-[A-Z0-9-]+$",
   "type": "string"
  },
  "scope_stamp": {
   "additionalProperties": false,
   "properties": {
    "corpus_case": {
     "description": "Corpus case id: C1 | C4 | C5 | C6 per WAVE1_CORPUS_MATRIX.md section 3. C6 is the negative control and carries the expected-refutation case of REFUTATION_STATE_MODEL.md section 3.",
     "minLength": 1,
     "type": "string"
    },
    "goal_item": {
     "description": "Goal item(s) under the authoritative goal (verbatim): \u6784\u5efa\u4e00\u4e2a Agent\uff0c\u80fd\u591f\u4ece\u6e90\u4ee3\u7801\u4e2d\u53d1\u73b0\u56fa\u4ef6/\u8f6f\u4ef6\u6545\u969c\u673a\u5236\uff0c\u5e76\u63a8\u5bfc\u51fa\u76f8\u5e94\u7684\u6545\u969c\u68c0\u6d4b/\u8bca\u65ad\u89c4\u5219\u3002 Wave-1 cites goal items 1-3, never redefining them (S0_GOAL_ADR.md section 8).",
     "minLength": 1,
     "type": "string"
    },
    "lineage": {
     "description": "Repository lineage (A/B/C per WAVE1_CORPUS_MATRIX.md); single-variant only (GA-4 fence).",
     "minLength": 1,
     "type": "string"
    },
    "schema_version": {
     "description": "Schema freeze id of this RuleCard contract (RULECARD_SCHEMA.json $id plus freeze revision).",
     "minLength": 1,
     "type": "string"
    }
   },
   "required": [
    "goal_item",
    "corpus_case",
    "lineage",
    "schema_version"
   ],
   "type": "object"
  },
  "trigger_conditions": {
   "description": "Structured deterministic predicates ONLY (rubric item 10). At least one predicate is required; free text is permitted ONLY in the optional rationale field of a predicate.",
   "items": {
    "additionalProperties": false,
    "properties": {
     "fact_refs": {
      "description": "FactRecords grounding this predicate.",
      "items": {
       "$ref": "#/definitions/factRef"
      },
      "minItems": 1,
      "type": "array"
     },
     "kind": {
      "description": "condition_text = enclosing conditional-chain text; config_symbol = build-config symbol state (Kconfig/-D/manifest); call_reachable = proven call/reachability edge; definition_absent = enumerated absence of a definition (E4/E7); definition_present = presence of a definition; value_comparison = comparison over out-of-band build values (G8-policed, never load-bearing alone).",
      "enum": [
       "condition_text",
       "config_symbol",
       "call_reachable",
       "definition_absent",
       "definition_present",
       "value_comparison"
      ],
      "type": "string"
     },
     "negatable": {
      "description": "True when the predicate has a well-defined deterministic negation that a refutation protocol step may target.",
      "type": "boolean"
     },
     "predicate_id": {
      "description": "Predicate identifier within the RuleCard (e.g. P1, P2).",
      "pattern": "^[A-Z0-9-]+$",
      "type": "string"
     },
     "rationale": {
      "description": "Optional free-text justification. This is the ONLY free-text field of a predicate.",
      "type": "string"
     },
     "statement": {
      "description": "Formal-ish deterministic predicate statement over the referenced facts (machine-evaluable wording); NOT a free-text narrative.",
      "minLength": 1,
      "type": "string"
     }
    },
    "required": [
     "predicate_id",
     "kind",
     "fact_refs",
     "statement",
     "negatable"
    ],
    "type": "object"
   },
   "minItems": 1,
   "type": "array"
  },
  "validation": {
   "additionalProperties": false,
   "description": "PMR-4 repair: separate evidence validation from fault-mechanism validation. Added by wave1-1-semantic-gate-1; absent on historical wave-1 cards.",
   "properties": {
    "evidence_integrity_status": {
     "enum": [
      "PASS",
      "DEGRADED",
      "FAIL",
      "PENDING"
     ],
     "type": "string"
    },
    "faultness_adjudicated_at": {
     "type": [
      "string",
      "null"
     ]
    },
    "faultness_roles": {
     "type": "object"
    },
    "faultness_status": {
     "enum": [
      "PASS",
      "FAIL",
      "PENDING",
      "NOT_APPLICABLE"
     ],
     "type": "string"
    },
    "refutation_state": {
     "type": "string"
    }
   },
   "required": [
    "evidence_integrity_status",
    "faultness_status",
    "refutation_state"
   ],
   "type": "object"
  },
  "validation_status": {
   "description": "Lifecycle status; allowed values are constrained by refutation_result.state and protocol_completed per REFUTATION_STATE_MODEL.md section 4.",
   "enum": [
    "unvalidated",
    "plant_tested",
    "refutation_executed",
    "accepted",
    "rejected"
   ],
   "type": "string"
  }
 },
 "required": [
  "rulecard_id",
  "mechanism_id",
  "hypothesis_ref",
  "fault_class",
  "scope_stamp",
  "trigger_conditions",
  "evidence",
  "provenance",
  "polarity",
  "forbidden_overclaims",
  "refutation_protocol",
  "refutation_result",
  "validation_status",
  "oracle_provenance"
 ],
 "title": "RuleCard (wave1-1-semantic-gate-1)",
 "type": "object"
}